{
  "appworld_imported": false,
  "checks": {
    "inventory_completed": true,
    "project_revision_matches": true,
    "read_only_boundary_closed": true,
    "tracked_worktree_clean": true,
    "wheel_is_outside_tracked_project": true,
    "wheel_path_is_absolute": true
  },
  "config_sha256": "94451e1cd1f6bd55ddd954956280a72737fb32c3588d33d3d7fc72e0544f315e",
  "expected_project_revision": "cc297f055b0439ed32c89cc18974a066eba10de5",
  "gpu_used": false,
  "inventory": {
    "bundle_count": 2,
    "bundle_paths": [
      "appworld/.source/apps.bundle",
      "appworld/.source/tests.bundle"
    ],
    "distribution": "appworld",
    "member_count": 44,
    "member_manifest_sha256": "65c1229057d82899d55f435e38b01ac62c037703f4b441dec44c6a2d5918aead",
    "members": [
      {
        "compressed_bytes": 1890,
        "relative_path": "appworld-0.1.3.post1.dist-info/METADATA",
        "sha256": "f4ff155fa03998a256725f4b76a5464e8d93b399553b508c85a6ab86eb3f51ed",
        "uncompressed_bytes": 6013
      },
      {
        "compressed_bytes": 2078,
        "relative_path": "appworld-0.1.3.post1.dist-info/RECORD",
        "sha256": "e038ec7fbcb751ada45d064b2a0a3da3c9cfd5c25f4617956a43fa4fd6fbf627",
        "uncompressed_bytes": 3667
      },
      {
        "compressed_bytes": 86,
        "relative_path": "appworld-0.1.3.post1.dist-info/WHEEL",
        "sha256": "909091253fe0d1a75f009cd3c761943264bcd2b4c92151d109f1b40d080bab7a",
        "uncompressed_bytes": 88
      },
      {
        "compressed_bytes": 41,
        "relative_path": "appworld-0.1.3.post1.dist-info/entry_points.txt",
        "sha256": "25312c986b8d9c56574605c6083c7a2361d9913ee2184e650335b9e604ccc0bc",
        "uncompressed_bytes": 46
      },
      {
        "compressed_bytes": 3948,
        "relative_path": "appworld-0.1.3.post1.dist-info/licenses/LICENSE",
        "sha256": "c71d239df91726fc519c6eb72d318ec65820627232b2f796219e87dcf35d0ab4",
        "uncompressed_bytes": 11357
      },
      {
        "compressed_bytes": 177264,
        "relative_path": "appworld/.source/apps.bundle",
        "sha256": "ba58bc5679c3573aa8f60ad6f5cda4377128a0ec569de5eef9543a77561796bb",
        "uncompressed_bytes": 177209
      },
      {
        "compressed_bytes": 171389,
        "relative_path": "appworld/.source/tests.bundle",
        "sha256": "93d53dea06f9d7c42cc03b66f4b08e4644c26b5ed41cdeaec0560c792bc16d8f",
        "uncompressed_bytes": 171334
      },
      {
        "compressed_bytes": 362,
        "relative_path": "appworld/__init__.py",
        "sha256": "cf69e62b1dc3f6274332ae5bcebc6331a4de92319a95ab7f4d2356e428bd62ba",
        "uncompressed_bytes": 742
      },
      {
        "compressed_bytes": 4274,
        "relative_path": "appworld/api_docs.py",
        "sha256": "deb1572dbcb0a240d9dfa9b2269b521a2514f89870f163c0a8b2d44ea730f070",
        "uncompressed_bytes": 21318
      },
      {
        "compressed_bytes": 3110,
        "relative_path": "appworld/apps/__init__.py",
        "sha256": "07ce8deb3160a8d6a52043fbc64b44a437f2721288c6e272ba3bfc81b368ad4b",
        "uncompressed_bytes": 10710
      },
      {
        "compressed_bytes": 10327,
        "relative_path": "appworld/apps/api_lib.py",
        "sha256": "573657c3db8d99def6ee92b6833fbc2fedd894be41031fe38feebab49e597485",
        "uncompressed_bytes": 50986
      },
      {
        "compressed_bytes": 571,
        "relative_path": "appworld/apps/factory_lib.py",
        "sha256": "7da594ac07bef806bc719fb571d7b82a1a62abb25473e6faa8de2d38188e8f9b",
        "uncompressed_bytes": 1302
      },
      {
        "compressed_bytes": 23999,
        "relative_path": "appworld/apps/model_lib.py",
        "sha256": "183a19463be31cd1a40a11022e24349f232595ca4b3612fa9d4b3a33bcf6c172",
        "uncompressed_bytes": 107067
      },
      {
        "compressed_bytes": 734,
        "relative_path": "appworld/apps/response_lib.py",
        "sha256": "50062d21b6702406424203dbd61305eeb93c802b19583a74996f5c7a314b1bf8",
        "uncompressed_bytes": 2471
      },
      {
        "compressed_bytes": 5644,
        "relative_path": "appworld/cli.py",
        "sha256": "e9abb0d358d14e837116aca33148322d9ed5c258f39f615b2d0b9d70340a24a4",
        "uncompressed_bytes": 23475
      },
      {
        "compressed_bytes": 2204,
        "relative_path": "appworld/collections/api_docs.py",
        "sha256": "dc2d0f5fe8d414de85ea28374cd98b29a87f6146f311a61eaa00cb5432e6e1ff",
        "uncompressed_bytes": 10638
      },
      {
        "compressed_bytes": 2515,
        "relative_path": "appworld/collections/api_docs.pyi",
        "sha256": "be18d7745f764f9224685944b3715c93456cd8e387deb329444e105bfd3d4e6b",
        "uncompressed_bytes": 30629
      },
      {
        "compressed_bytes": 2389,
        "relative_path": "appworld/collections/apis.py",
        "sha256": "597aa608dd2447b8e77805490baa0289d549fb79c6d3d2b382637713e5a4eefe",
        "uncompressed_bytes": 8002
      },
      {
        "compressed_bytes": 7659,
        "relative_path": "appworld/collections/apis.pyi",
        "sha256": "2659d40d2be70bf0041231befc0b34cb2014315eb6dc839e2ec56a31afb875ed",
        "uncompressed_bytes": 95246
      },
      {
        "compressed_bytes": 4951,
        "relative_path": "appworld/collections/models.py",
        "sha256": "8466cf8efd13450dfc81d57b013ba96fde0a4ba47955def585c34f36af1a31ec",
        "uncompressed_bytes": 23794
      },
      {
        "compressed_bytes": 1320,
        "relative_path": "appworld/collections/models.pyi",
        "sha256": "ad5e499da10aa9ea5305be19e14ffe0ec8132a36296fbe6286bf58f99a720c47",
        "uncompressed_bytes": 5576
      },
      {
        "compressed_bytes": 2,
        "relative_path": "appworld/common/__init__.py",
        "sha256": "e3b0c44298fc1c149afbf4c8996fb92427ae41e4649b934ca495991b7852b855",
        "uncompressed_bytes": 0
      },
      {
        "compressed_bytes": 5650,
        "relative_path": "appworld/common/code_parsing.py",
        "sha256": "29cb3788d8523dbad2070dc30745ff07b210b03d0361afd08e591f5d45b52f27",
        "uncompressed_bytes": 27764
      },
      {
        "compressed_bytes": 483,
        "relative_path": "appworld/common/constants.py",
        "sha256": "8235a48307df84e3a24cbeb66e10a1a9ea1eef8c2cfdc533c86a3bc7d222d074",
        "uncompressed_bytes": 893
      },
      {
        "compressed_bytes": 169,
        "relative_path": "appworld/common/copy.py",
        "sha256": "b87c8b50051fdf7893df28681161e62c649329a0cc6e9a19e2c988ef2b20fcb9",
        "uncompressed_bytes": 244
      },
      {
        "compressed_bytes": 5081,
        "relative_path": "appworld/common/datetime.py",
        "sha256": "7f81ad40e7f57383001f48ef434da6bc6d4ecddf17fc09bef216118e4ec1f020",
        "uncompressed_bytes": 29147
      },
      {
        "compressed_bytes": 377,
        "relative_path": "appworld/common/path_store.py",
        "sha256": "31d65b6a9adf97a7be635aec7bbe2e2057bf9dab1fe845f7466467cd3f6ae547",
        "uncompressed_bytes": 1459
      },
      {
        "compressed_bytes": 1575,
        "relative_path": "appworld/common/random.py",
        "sha256": "7c96467e467718b58d434fc7020cdfd097668045453f951059ed07b062999ca8",
        "uncompressed_bytes": 7504
      },
      {
        "compressed_bytes": 2320,
        "relative_path": "appworld/common/safety_guard.py",
        "sha256": "fa105c1bc55bc9fc3dba70f414bdfcb43e05fcede06e63477ceb712037044da7",
        "uncompressed_bytes": 8673
      },
      {
        "compressed_bytes": 267,
        "relative_path": "appworld/common/types.py",
        "sha256": "b5b17b135837d7379d83828a98801a93010274b7842f07dfcf948fe5e4e0f2ba",
        "uncompressed_bytes": 506
      },
      {
        "compressed_bytes": 35395,
        "relative_path": "appworld/common/utils.py",
        "sha256": "e7007b689413e176d852c462ba67f29d8897d17fa78029a9ce5c65047c7c0b0c",
        "uncompressed_bytes": 161515
      },
      {
        "compressed_bytes": 628,
        "relative_path": "appworld/download.py",
        "sha256": "2e3a8fb40ceb51e6ceae7c312bcfd6990807876f0f695dad4c61df4df38ee9c9",
        "uncompressed_bytes": 2154
      },
      {
        "compressed_bytes": 7212,
        "relative_path": "appworld/environment.py",
        "sha256": "ad650588158727c4ebe72a080638ec0174c33af8a8b9e9b81f3d9bfda55d3fd9",
        "uncompressed_bytes": 34148
      },
      {
        "compressed_bytes": 5908,
        "relative_path": "appworld/evaluator.py",
        "sha256": "4e773fb91cdad3ad10deeacde2d0b1f717454be599e6758419e8e1bb88b75cba",
        "uncompressed_bytes": 24232
      },
      {
        "compressed_bytes": 3142,
        "relative_path": "appworld/ground_truth.py",
        "sha256": "b956f31eb82d3af9c3ccdae7acec9adeb5f8735b5efe77859d62248ec7655f32",
        "uncompressed_bytes": 16253
      },
      {
        "compressed_bytes": 484,
        "relative_path": "appworld/install.py",
        "sha256": "5f9fba34737afea0bb7fd2f8ec04d44a7fcaced8760e1c3a2c8dd0066ccb0446",
        "uncompressed_bytes": 2651
      },
      {
        "compressed_bytes": 2100,
        "relative_path": "appworld/leaderboard.py",
        "sha256": "8c799b2f25086c9848bc0ead3ebdd6529c00d7b160815e95deb600497b019b52",
        "uncompressed_bytes": 9360
      },
      {
        "compressed_bytes": 5729,
        "relative_path": "appworld/requester.py",
        "sha256": "9660a3ab9bf222c64d4f265a6551d375368faf652b783e3ab0996389e5137bec",
        "uncompressed_bytes": 28277
      },
      {
        "compressed_bytes": 444,
        "relative_path": "appworld/serve/apis.py",
        "sha256": "c3c4fe0ac3cdd9091a821b08e79f65f6e7421b28d6b864ac976b2c8e64902bc4",
        "uncompressed_bytes": 959
      },
      {
        "compressed_bytes": 2126,
        "relative_path": "appworld/serve/environment.py",
        "sha256": "8518ee939ed9355cd2bdd43b59e930544f9814eb84d9724e598b1b1c9379067d",
        "uncompressed_bytes": 7850
      },
      {
        "compressed_bytes": 6908,